 Dataset Name ; Brief description ; Preprocessing ; Instances ; Format ; Default Task ; Created (updated) ; Reference ; Creator 
Zero Resource Speech Challenge 2015 ;Spontaneous speech (English), Read speech (Xitsonga). ;raw wav  ; English: 5h, 12 speakers, Xitsonga: 2h30, 24 speakers ;sound ;Unsupervised discovery of speech features/subword units/word units ;2015 ;M. Versteegh, R. Thiollière, T. Schatz, X.-N. Cao, X. Anguera, A. Jansen, and E. Dupoux (2015).  "The Zero Resource Speech Challenge 2015," in INTERSPEECH-2015.M. Versteegh, X. Anguera, A. Jansen, and E. Dupoux, (2016). "The Zero Resource Speech Challenge 2015: Proposed Approaches and Results," in SLTU-2016. ;Versteegh et al. 
Parkinson Speech Dataset ;Multiple recordings of people with and without Parkinson's Disease. ;Voice features extracted, disease scored by physician using unified Parkinson's disease rating scale ;1,040 ;Text ;Classification, regression ;2013 ; s2cid = 15491516 Zhao, Shunan, et al. "Automatic detection of expressed emotion in Parkinson's disease." Acoustics, Speech and Signal Processing (ICASSP), 2014 IEEE International Conference on. IEEE, 2014. ;B. E. Sakar et al. 
Spoken Arabic Digits ;Spoken Arabic digits from 44 male and 44 female. ;Time-series of mel-frequency cepstrum coefficients. ;8,800 ;Text ;Classification ;2010 ;Used in: Hammami, Nacereddine, and Mouldi Bedda. "Improved tree model for Arabic speech recognition." Computer Science and Information Technology (ICCSIT), 2010 3rd IEEE International Conference on. Vol. 5. IEEE, 2010.Maaten, Laurens. "Learning discriminative fisher kernels." Proceedings of the 28th International Conference on Machine Learning (ICML-11). 2011. ;M. Bedda et al. 
ISOLET Dataset ;Spoken letter names. ;Features extracted from sounds. ;7797 ;Text ;Classification ;1994 ;Cole, Ronald, and Mark Fanty. "Spoken letter recognition." Proc. Third DARPA Speech and Natural Language Workshop. 1990. pages = 203–233  ;R. Cole et al. 
Japanese Vowels Dataset ;Nine male speakers uttered two Japanese vowels successively. ;Applied 12-degree linear prediction analysis to it to obtain a discrete-time series with 12 cepstrum coefficients. ;640 ;Text ;Classification ;1999 ; citeseerx = 10.1.1.46.2515  pmid = 17517495  ;M. Kudo et al. 
Parkinson's Telemonitoring Dataset ;Multiple recordings of people with and without Parkinson's Disease. ;Sound features extracted. ;5875 ;Text ;Classification ;2009 ; type = Submitted manuscript  pmid = 22053737  ;A. Tsanas et al. 
TIMIT ;Recordings of 630 speakers of eight major dialects of American English, each reading ten phonetically rich sentences. ;Speech is lexically and phonemically transcribed. ;6300 ;Text ;Speech recognition, classification. ;1986 ; doi=10.1016/0167-6393(90)90010-7Kapadia, Sadik, Valtcho Valtchev, and S. J. Young. "MMI training for continuous phoneme recognition on the TIMIT database." Acoustics, Speech, and Signal Processing, 1993. ICASSP-93., 1993 IEEE International Conference on. Vol. 2. IEEE, 1993. ;J. Garofolo et al. 
Arabic Speech Corpus ;A single-speaker, Modern Standard Arabic (MSA) speech corpus with phonetic and orthographic transcripts aligned to phoneme level ;Speech is orthographically and phonetically transcribed with stress marks. ;~1900 ;Text, WAV ;Speech Synthesis, Speech Recognition, Corpus Alignment, Speech Therapy, Education. ;2016 ;publisher=University of Southampton, School of Electronics and Computer Science ;N. Halabi 
Common Voice ;A public domain database of crowdsourced data across a wide range of dialects.  ;Validation by other users  ;English: 1,118 hours ;MP3 with corresponding text files  ;Speech recognition ;June 2017 (December 2019) ; eprint=1912.06670v2  ;Mozilla 
